{
  "schemaVersion": "1.0.0",
  "generator": "NL Asset Control",
  "generatedAt": "2026-08-18T04:41:34.5821926+00:00",
  "themeCount": 50,
  "themes": [
    {
      "id": "100th-day-of-school",
      "name": "100th Day of School",
      "description": "Photo Album recipe using the shared eight-slot contract for 100th Day of School.",
      "collectionIds": [
        "album-theme-100th-day-of-school"
      ],
      "assetSlots": {
        "banner": [
          "abacus-390866ad8b",
          "bright-student-21b47c333b",
          "calculator-a1af26ef9e",
          "class-teacher-5e440e7527",
          "education-robot-76ee96f5be",
          "math-teacher-8f136f6303",
          "sad-student-4c17677bb2",
          "student-degree-03e8e43def"
        ],
        "top-trim": [
          "garlands-30beb325f4",
          "hawaii-garland-d8e6ae4401",
          "scale-divider-5bf5fad325"
        ],
        "bottom-trim": [
          "garlands-30beb325f4",
          "hawaii-garland-d8e6ae4401",
          "scale-divider-5bf5fad325"
        ],
        "photo-frame": [],
        "corner-accent": [
          "abacus-390866ad8b",
          "calculator-a1af26ef9e",
          "education-robot-76ee96f5be",
          "alarm-clock-dcde8fdfe7",
          "alphabet-blocks-08ef6d8340",
          "alphabet-popsicle-11a48b9adf",
          "alphabet-puzzle-073406a8b5",
          "atom-cb9da277e8"
        ],
        "background": [
          "glass-magnifying-3d-icon-9b6f6791c1",
          "reading-glasses-bfd1553f94",
          "magnifying-glass-1ec65aa24b",
          "magnifying-glass-c334982113",
          "star-glasses-9b959fbba7"
        ],
        "divider": [
          "garlands-30beb325f4",
          "hawaii-garland-d8e6ae4401",
          "scale-divider-5bf5fad325"
        ],
        "decorations": [
          "abacus-390866ad8b",
          "bright-student-21b47c333b",
          "calculator-a1af26ef9e",
          "class-teacher-5e440e7527",
          "education-robot-76ee96f5be",
          "math-teacher-8f136f6303",
          "sad-student-4c17677bb2",
          "student-degree-03e8e43def",
          "student-solving-10b9a7e51b",
          "student-trophy-a101d5e4b5",
          "teacher-7a20a835d2",
          "vctrly-student-education-learning-college-campus-book-study-boar-3acdd5f92d",
          "vctrly-student-education-learning-college-campus-book-study-math-ed183eb973",
          "virtual-teacher-7ab7d2ba92",
          "alarm-clock-dcde8fdfe7",
          "alphabet-blocks-08ef6d8340",
          "alphabet-popsicle-11a48b9adf",
          "alphabet-puzzle-073406a8b5",
          "atom-cb9da277e8",
          "binder-file-584ce84640",
          "biology-teacher-8475f4d3e5",
          "blocks-1755cf7c71",
          "books-717a709a7f",
          "boost-knowledge-8e96abb5eb"
        ]
      }
    },
    {
      "id": "apple-orchard",
      "name": "Apple Orchard",
      "description": "Photo Album recipe using the shared eight-slot contract for Apple Orchard.",
      "collectionIds": [
        "album-theme-apple-orchard"
      ],
      "assetSlots": {
        "banner": [
          "autumn-forest-7e0183a203",
          "autumn-trees-e4724a21c4",
          "tree-stump-4c2f2bac07",
          "almond-bowl-bfb39ca0ce",
          "animal-feeder-fceab76f4c",
          "automatic-feeder-a7fa3ffa81",
          "autumn-cottage-837a7383bd",
          "autumn-splendor-94a8692f6e"
        ],
        "top-trim": [],
        "bottom-trim": [],
        "photo-frame": [],
        "corner-accent": [
          "autumn-forest-7e0183a203",
          "autumn-trees-e4724a21c4",
          "tree-stump-4c2f2bac07",
          "almond-bowl-bfb39ca0ce",
          "animal-feeder-fceab76f4c",
          "automatic-feeder-a7fa3ffa81",
          "autumn-cottage-837a7383bd",
          "autumn-splendor-94a8692f6e"
        ],
        "background": [],
        "divider": [],
        "decorations": [
          "autumn-forest-7e0183a203",
          "autumn-trees-e4724a21c4",
          "tree-stump-4c2f2bac07",
          "almond-bowl-bfb39ca0ce",
          "animal-feeder-fceab76f4c",
          "automatic-feeder-a7fa3ffa81",
          "autumn-cottage-837a7383bd",
          "autumn-splendor-94a8692f6e",
          "bale-grabber-8490471370",
          "bamboo-cage-264a34c569",
          "bamboo-forest-bbb34f00f2",
          "bamboo-sticks-fab1002a1f",
          "barn-273f8af229",
          "bell-b45739e887",
          "bird-bath-162fe57e18",
          "birdhouse-b2a7830faa",
          "blooming-flowers-9cc5b9a46b",
          "bucket-trowel-9ebad5df2d",
          "bug-hotel-282d5f4c50",
          "cabbage-edbd0d1612",
          "carrot-box-5542924338",
          "cattle-farm-f76626211b",
          "cattle-prodder-b6c45fe679",
          "christmas-tree-5535a723c1"
        ]
      }
    },
    {
      "id": "art-studio",
      "name": "Art Studio",
      "description": "Photo Album recipe using the shared eight-slot contract for Art Studio.",
      "collectionIds": [
        "album-theme-art-studio"
      ],
      "assetSlots": {
        "banner": [
          "canvas-painting-5ea2984a76",
          "drawing-compass-24d90551aa",
          "drawing-paper-08f3ec97bb",
          "drawing-tools-717bc7a46a",
          "stationery-tools-drawing-doodles-0c416e309d",
          "vctrly-studio-work-creative-creativity-art-productions-artist-pa-cac7016c38",
          "abacus-390866ad8b",
          "alarm-clock-dcde8fdfe7"
        ],
        "top-trim": [
          "scale-divider-5bf5fad325",
          "garlands-30beb325f4",
          "hawaii-garland-d8e6ae4401"
        ],
        "bottom-trim": [
          "scale-divider-5bf5fad325",
          "garlands-30beb325f4",
          "hawaii-garland-d8e6ae4401"
        ],
        "photo-frame": [
          "hanging-frame-76be23b74d",
          "modular-frame-a8a36becbf",
          "photo-frame-970e2e989f",
          "victorian-frame-a97e34cabe"
        ],
        "corner-accent": [
          "canvas-painting-5ea2984a76",
          "drawing-compass-24d90551aa",
          "drawing-paper-08f3ec97bb",
          "drawing-tools-717bc7a46a",
          "stationery-tools-drawing-doodles-0c416e309d",
          "vctrly-studio-work-creative-creativity-art-productions-artist-pa-cac7016c38",
          "abacus-390866ad8b",
          "alarm-clock-dcde8fdfe7"
        ],
        "background": [
          "magnifying-glass-1ec65aa24b",
          "reading-glasses-bfd1553f94",
          "magnifying-glass-c334982113",
          "magnifying-glass-fcf780bba5",
          "reading-glasses-2b7920a060",
          "roman-glass-135c9b02b8",
          "safety-glasses-13ceb31c87",
          "star-glasses-9b959fbba7"
        ],
        "divider": [
          "scale-divider-5bf5fad325",
          "garlands-30beb325f4",
          "hawaii-garland-d8e6ae4401"
        ],
        "decorations": [
          "canvas-painting-5ea2984a76",
          "drawing-compass-24d90551aa",
          "drawing-paper-08f3ec97bb",
          "drawing-tools-717bc7a46a",
          "stationery-tools-drawing-doodles-0c416e309d",
          "vctrly-studio-work-creative-creativity-art-productions-artist-pa-cac7016c38",
          "abacus-390866ad8b",
          "alarm-clock-dcde8fdfe7",
          "alphabet-blocks-08ef6d8340",
          "alphabet-popsicle-11a48b9adf",
          "alphabet-puzzle-073406a8b5",
          "apron-f23492c288",
          "art-book-532b5d2cf4",
          "atom-cb9da277e8",
          "backpack-e802bc20db",
          "barcode-printer-dfbb423ab8",
          "binder-clips-9316dcb2dc",
          "binder-file-584ce84640",
          "biology-teacher-8475f4d3e5",
          "blocks-1755cf7c71",
          "book-538f5c7168",
          "books-717a709a7f",
          "books-stock-0447fa39cd",
          "boost-knowledge-8e96abb5eb"
        ]
      }
    },
    {
      "id": "autumn-harvest",
      "name": "Autumn Harvest",
      "description": "Photo Album recipe using the shared eight-slot contract for Autumn Harvest.",
      "collectionIds": [
        "album-theme-autumn-harvest"
      ],
      "assetSlots": {
        "banner": [
          "almond-bowl-bfb39ca0ce",
          "animal-feeder-fceab76f4c",
          "automatic-feeder-a7fa3ffa81",
          "bale-grabber-8490471370",
          "barn-273f8af229",
          "bell-b45739e887",
          "birdhouse-b2a7830faa",
          "blooming-flowers-9cc5b9a46b"
        ],
        "top-trim": [],
        "bottom-trim": [],
        "photo-frame": [],
        "corner-accent": [
          "almond-bowl-bfb39ca0ce",
          "animal-feeder-fceab76f4c",
          "automatic-feeder-a7fa3ffa81",
          "bale-grabber-8490471370",
          "barn-273f8af229",
          "bell-b45739e887",
          "birdhouse-b2a7830faa",
          "blooming-flowers-9cc5b9a46b"
        ],
        "background": [],
        "divider": [],
        "decorations": [
          "almond-bowl-bfb39ca0ce",
          "animal-feeder-fceab76f4c",
          "automatic-feeder-a7fa3ffa81",
          "bale-grabber-8490471370",
          "barn-273f8af229",
          "bell-b45739e887",
          "birdhouse-b2a7830faa",
          "blooming-flowers-9cc5b9a46b",
          "cabbage-edbd0d1612",
          "carrot-box-5542924338",
          "cattle-farm-f76626211b",
          "cattle-prodder-b6c45fe679",
          "corn-plant-a56f1031a5",
          "cow-10815fc4e2",
          "door-229f828fb4",
          "drilling-machine-fd049a3231",
          "dumper-305ea38b11",
          "egg-collector-f7db41045e",
          "egg-incubator-c649fdbd77",
          "egg-tray-deec8a412e",
          "eggplant-d21f6eb5fa",
          "farm-boots-0f79117aea",
          "farm-cart-0cc4543e0c",
          "farm-drone-2bc95b11ad"
        ]
      }
    },
    {
      "id": "awards-achievement",
      "name": "Awards \u0026 Achievement",
      "description": "Photo Album recipe using the shared eight-slot contract for Awards \u0026 Achievement.",
      "collectionIds": [
        "album-theme-awards-achievement"
      ],